{
  "$schema": "./schemas/marketplace.meta.schema.json",
  "name": "galaxio-performance-kit",
  "displayName": "Galaxio Performance Kit",
  "description": "Galaxio engineering workflows packaged as portable agent plugins for Cursor, Claude Code and Codex",
  "owner": {
    "name": "Galaxio Team",
    "url": "https://github.com/galax-io"
  },
  "repository": "https://github.com/galax-io/ai-plugins"
}
